{
  "id": "atc-ual",
  "name": "UAL",
  "declaredTopicCount": 32,
  "declaredCardCount": 540,
  "topicIds": [
    "atc-scenario-0033",
    "atc-scenario-0034",
    "atc-scenario-0035",
    "atc-scenario-0036",
    "atc-scenario-0037",
    "atc-scenario-0038",
    "atc-scenario-0039",
    "atc-scenario-0040",
    "atc-scenario-0041",
    "atc-scenario-0110",
    "atc-scenario-0168",
    "atc-scenario-0169",
    "atc-scenario-0170",
    "atc-scenario-0171",
    "atc-scenario-0172",
    "atc-scenario-0173",
    "atc-scenario-0174",
    "atc-scenario-0175",
    "atc-scenario-0176",
    "atc-fzy-1055",
    "atc-fzy-1381",
    "atc-fzy-1516",
    "atc-fzy-1517",
    "atc-fzy-600",
    "atc-fzy-620",
    "atc-fzy-621",
    "atc-fzy-622",
    "atc-fzy-638",
    "atc-fzy-643",
    "atc-fzy-753",
    "atc-fzy-788",
    "atc-fzy-908"
  ]
}
