{
  "id": "atc-aca",
  "name": "ACA",
  "declaredTopicCount": 9,
  "declaredCardCount": 155,
  "topicIds": [
    "atc-scenario-0045",
    "atc-scenario-0046",
    "atc-scenario-0047",
    "atc-scenario-0048",
    "atc-scenario-0049",
    "atc-scenario-0050",
    "atc-scenario-0051",
    "atc-scenario-0106",
    "atc-scenario-0107"
  ]
}
